{
  "$schema": "https://json-schema.org/draft/2020-12/schema",
  "$id": "subjectkg/student-profile",
  "title": "Student Profile",
  "description": "The harness's persistent memory of one student. Updated after every session (Hard Rule). Lives at students/<id>/profile.json.",
  "type": "object",
  "required": ["id", "created", "grade", "mastery", "strategy_stats", "behavior", "spaced_repetition"],
  "properties": {
    "id": { "type": "string", "pattern": "^S[0-9]{3,}$", "description": "Anonymous ID; never store real names here (keep any name only in students/<id>/private-notes.md, gitignored)." },
    "created": { "type": "string", "format": "date" },
    "grade": { "type": "integer", "minimum": 1, "maximum": 12, "description": "Nominal school grade. Actual level comes from mastery, not this." },
    "goals": {
      "type": "object",
      "properties": {
        "target": { "type": "string" },
        "exam_date": { "type": "string", "format": "date" },
        "notes": { "type": "string" }
      }
    },
    "interests": { "type": "array", "items": { "type": "string" }, "description": "Used for problem contexts and hooks: cricket, drawing, space, Minecraft... Refresh every few sessions; each entry may carry specifics, e.g. 'cricket (bats left-handed, follows RCB)'." },
    "language": {
      "type": "object",
      "description": "How this student prefers to be TALKED to. Notation stays standard; explanations flex.",
      "properties": {
        "explanation": { "type": "string", "description": "Preferred language/register for explanations, e.g. 'english', 'hinglish', 'hindi', 'tamil-english mix'. Honor it in every session." },
        "notes": { "type": "string", "description": "e.g. 'switches to Hindi when a concept is hard - follow her there, return to English for the summary'." }
      }
    },
    "motivation": {
      "type": "object",
      "description": "What actually drives this student. Chosen rewards/celebrations must match drivers (rules/40). Never peer comparison.",
      "properties": {
        "drivers": {
          "type": "array",
          "items": { "enum": ["mastery-pride", "streaks", "personal-record", "story-completion", "show-family", "curiosity", "autonomy", "helping-others"] },
          "description": "Ranked, strongest first. From the intake interview + observed reactions."
        },
        "streaks": {
          "type": "object",
          "properties": {
            "current_sessions": { "type": "integer", "description": "Consecutive sessions attended." },
            "best_sessions": { "type": "integer" },
            "reviews_cleared_in_a_row": { "type": "integer" },
            "personal_records": { "type": "array", "items": { "type": "string" }, "description": "e.g. 'first 3/3 topic test (2026-07-02, mult-tables)'. Reference these; beating your own record is the only competition allowed." }
          }
        },
        "celebrations_that_landed": { "type": "array", "items": { "type": "string" }, "description": "Observed: what genuinely delighted them vs. what fell flat." }
      }
    },
    "retention": {
      "type": "object",
      "description": "Personal forgetting curve, per strand. Multiplier scales the review ladder in rules/10 (1.0 = standard). Tuned by /reflect from lapse data: strand lapse rate < 10% over >= 5 reviews -> nudge up (max 1.5); > 30% -> nudge down (min 0.6). Move in 0.1 steps, never on fewer than 5 observations.",
      "additionalProperties": { "type": "number", "minimum": 0.5, "maximum": 1.6 }
    },
    "error_signature": {
      "type": "array",
      "description": "Cross-topic error habits - about the STUDENT, not any one node. Mined by /reflect (all) from question history. Coach the habit explicitly; a repaired habit pays off everywhere.",
      "items": {
        "type": "object",
        "required": ["pattern", "evidence_count"],
        "properties": {
          "pattern": { "type": "string", "description": "e.g. 'drops negative signs when working fast', 'reads OF as addition in word problems', 'answers before reading the full question'." },
          "evidence_count": { "type": "integer" },
          "first_seen": { "type": "string", "format": "date" },
          "status": { "enum": ["active", "improving", "beaten"] },
          "coaching": { "type": "string", "description": "The move that helps, e.g. 'ritual: circle every minus sign before starting'." }
        }
      }
    },
    "mastery": {
      "type": "object",
      "description": "Keyed by KG node id.",
      "additionalProperties": {
        "type": "object",
        "required": ["score", "evidence_count", "last_seen"],
        "properties": {
          "score": { "type": "number", "minimum": 0, "maximum": 1 },
          "evidence_count": { "type": "integer" },
          "last_seen": { "type": "string", "format": "date" },
          "conceptual_ok": { "type": "boolean", "description": "At least one conceptual/application item answered correctly (required for true mastery)." },
          "misconceptions_active": {
            "type": "array",
            "items": {
              "type": "object",
              "required": ["id", "first_seen"],
              "properties": {
                "id": { "type": "string", "description": "Misconception id within that node, e.g. m2." },
                "first_seen": { "type": "string", "format": "date" },
                "repair_stage": { "enum": ["observed", "confronted", "retest-due", "repaired"] },
                "retests_passed": {
                  "type": "integer",
                  "minimum": 0,
                  "description": "How many targeted retests this misconception has passed since being confronted. Two are required before repair_stage becomes 'repaired' (rules/40 §5: retest after 2 days, then 7)."
                },
                "retest_after": { "type": "string", "format": "date", "description": "When the next repair-confirmation retest is due (rules/40: +2d, then +7d)." },
                "notes": { "type": "string" }
              }
            }
          }
        }
      }
    },
    "strategy_stats": {
      "type": "object",
      "description": "Keyed by strategy name (modality or thinking routine, optionally scoped ':strand', e.g. 'visual:num', 'socratic', 'see-think-wonder').",
      "additionalProperties": {
        "type": "object",
        "required": ["tried", "worked"],
        "properties": {
          "tried": { "type": "integer" },
          "worked": { "type": "integer", "description": "Sessions where the follow-up check succeeded after this strategy." },
          "last_used": { "type": "string", "format": "date" },
          "notes": { "type": "string" }
        }
      }
    },
    "behavior": {
      "type": "object",
      "properties": {
        "attention_span_min": { "type": "number", "description": "Observed productive minutes before a break is needed." },
        "session_sweet_spot_min": { "type": "number" },
        "best_time_of_day": { "type": "string" },
        "hint_appetite": { "enum": ["asks-immediately", "healthy", "never-asks"] },
        "frustration_signals": { "type": "array", "items": { "type": "string" }, "description": "Observed tells: short answers, 'whatever', asks to switch topic..." },
        "reengagement_moves": { "type": "array", "items": { "type": "string" }, "description": "What has actually re-engaged this student." },
        "impulsivity": { "enum": ["impulsive", "balanced", "hesitant"], "description": "From latency×correctness patterns." },
        "own_metaphors": { "type": "array", "items": { "type": "string" }, "description": "The student's own working metaphors — reuse them when teaching." }
      }
    },
    "affect": {
      "type": "object",
      "properties": {
        "confidence_by_strand": { "type": "object", "additionalProperties": { "type": "number", "minimum": 0, "maximum": 1 } },
        "anxiety_flags": { "type": "array", "items": { "type": "string" } },
        "praise_response": { "type": "string" }
      }
    },
    "calibration": {
      "type": "object",
      "properties": {
        "samples": { "type": "integer" },
        "overconfidence": { "type": "number", "description": "Mean(predicted−actual); positive = overconfident." }
      }
    },
    "spaced_repetition": {
      "type": "object",
      "description": "Keyed by KG node id.",
      "additionalProperties": {
        "type": "object",
        "required": ["next_review", "interval_days"],
        "properties": {
          "next_review": { "type": "string", "format": "date" },
          "interval_days": { "type": "number" },
          "lapses": { "type": "integer" }
        }
      }
    },
    "session_count": { "type": "integer" },
    "projection_from": {
      "type": ["string", "null"],
      "format": "date",
      "description": "The date from which students/<id>/sessions/ is the authoritative ledger for this profile. Fields before it were seeded from a profile written before session logging existed, and cannot be reprojected. null means the whole profile is derived from logs."
    },
    "seed": {
      "type": "object",
      "description": "Frozen pre-ledger snapshot for a student whose profile predates session logging. Written once at migration and never again: the projection copies it through verbatim and derives the top-level mastery/spaced_repetition from it plus the logs dated on or after projection_from. It must never be updated from a projection's output, because that would make each session count twice.",
      "properties": {
        "mastery": { "type": "object" },
        "spaced_repetition": { "type": "object" },
        "session_count": { "type": "integer", "minimum": 0 },
        "last_session": { "type": ["string", "null"], "format": "date" }
      }
    },
    "last_session": { "type": ["string", "null"], "format": "date", "description": "null until the first session." }
  }
}
