{
  "$schema": "../../harness/schemas/student-profile.schema.json",
  "id": "S001",
  "created": "2026-07-12",
  "grade": 9,
  "goals": {
    "target": "",
    "notes": ""
  },
  "interests": [
    "building/developing web applications",
    "coding & making things"
  ],
  "language": {
    "explanation": "english",
    "notes": "learns by dialogue - asking, back-and-forth; lean Socratic + explain-it-back"
  },
  "motivation": {
    "drivers": [
      "mastery-pride",
      "curiosity",
      "autonomy"
    ],
    "streaks": {
      "current_sessions": 1,
      "best_sessions": 1,
      "reviews_cleared_in_a_row": 0,
      "personal_records": []
    },
    "celebrations_that_landed": []
  },
  "retention": {},
  "error_signature": [],
  "mastery": {},
  "strategy_stats": {},
  "behavior": {
    "hint_appetite": "healthy",
    "frustration_signals": [],
    "reengagement_moves": [],
    "own_metaphors": []
  },
  "affect": {
    "confidence_by_strand": {},
    "anxiety_flags": [],
    "praise_response": "finds maths fun - respond well to being challenged, not coddled"
  },
  "calibration": {
    "samples": 0,
    "overconfidence": 0
  },
  "spaced_repetition": {},
  "session_count": 0,
  "last_session": null,
  "projection_from": "2026-07-12",
  "seed": {
    "mastery": {},
    "spaced_repetition": {},
    "session_count": 0,
    "last_session": null
  }
}